{
  "schemaVersion": "1.0.0",
  "header": {
    "generator": "AssemblyChain",
    "author": "sample-user",
    "description": "Example process export",
    "createdUtc": "2025-09-26T00:00:00Z"
  },
  "steps": [
    {
      "index": 0,
      "partId": "Part_A",
      "direction": [0.0, 0.0, 1.0],
      "batch": 0,
      "insert": true
    }
  ],
  "metadata": {
    "solver": "CSP",
    "feasible": true,
    "optimal": false,
    "solveTime": 0.12,
    "stepCount": 1
  }
}
